Number;Start time in milliseconds;End time in milliseconds;"Text"
1;3080;5010;"Heavens Arena."
2;5010;10990;"The 251-story, 991-meter 
building is a mecca for fighters."
3;11520;13530;"When combatants win a fight,"
4;14170;17420;"they may advance by one class,"
5;17420;20460;"and receive a corresponding reward."
6;20460;22030;"After reaching the 100th floor,"
7;22030;24170;"you are assigned a private room."
8;24790;26550;"After reaching the 200th floor,"
9;26550;32690;"you receive the right to challenge 
the strongest fighters,"
10;32690;37010;"the Floor Masters, in an intense 
battle of survival."
11;37630;40880;"This is the best stage"
12;40880;42890;"a warrior could ask for."
13;126900;128710;"Only one thing can protect you"
14;128710;130520;"from someone who uses <i>Nen</i>."
15;131120;134020;"You must also learn to use <i>Nen</i>."
16;134580;136530;"You must use <i>Ten</i> for defense."
17;137050;138650;"Otherwise..."
18;144020;147750;"Your body will be crushed."
19;147750;152750;"Awakening x And x Potential"
20;154480;155850;"As the hour grows late,"
21;155850;158590;"Wing's lecture has reached its climax."
22;162460;165010;"But they only have until midnight."
23;165570;166710;"Before that time,"
24;166710;170510;"Gon and Killua must learn <i>Nen</i>."
25;171790;175520;"<i>Nen</i> is a power that dwells 
within every person."
26;176150;177840;"However, at present,"
27;177840;181340;"only a few are capable of using that power."
28;181340;185490;"Thus, they are treated as 
geniuses, leaders, psychics,"
29;185490;189540;"mystics, or superhumans."
30;190380;192620;"A power that dwells within everyone..."
31;192620;193740;"Yes."
32;193740;195040;"And there are two means"
33;195040;198050;"by which to awaken this power."
34;198830;201510;"The deliberate way and the aggressive way."
35;202130;204550;"Zushi underwent the deliberate method."
36;205030;208560;"He was a quick learner, and he trained hard."
37;208560;212000;"So he was able to master <i>Ten</i> 
in a very short time."
38;212960;214620;"In about six months."
39;215120;216620;"That's too long..."
40;216620;218570;"We need to learn <i>Ten</i>,"
41;218870;221570;"and pass Hisoka's <i>Nen</i> barrier before midnight!"
42;222190;224890;"Then you'll have to try the aggressive method."
43;224890;226580;"Will it be fast enough?"
44;227110;229060;"That will depend on you."
45;229060;233860;"Can you learn to hold your aura within 
your body, before time runs out?"
46;234540;236540;"That is the key."
47;237170;241060;"I will now direct my aura toward you."
48;241060;243730;"This is known as <i>Hatsu</i>, 
which I demonstrated earlier."
49;247250;250840;"Naturally, I will restrain myself, 
since my objective is not"
50;250840;252730;"to destroy your bodies."
51;253220;256310;"However, this way is still perilous."
52;256310;260360;"In other words, I will attempt 
to shock you into awakening."
53;260900;263450;"I will give your sleeping body a jolt,"
54;263450;266370;"so you can learn <i>Ten</i> more easily."
55;266830;268570;"I say that your body sleeps because"
56;268570;271740;"your body's openings, 
or micropyles, are closed,"
57;271740;274370;"meaning that your aura flow is stunted."
58;274920;276250;"Therefore,"
59;276250;279860;"I will send my aura into your bodies,"
60;279860;282130;"to open your micropyles."
61;280400;284880;"{\fad(339,1)}[Micropyles]
Numerous pores in the body, 
which release aura."
62;287780;291020;"Under normal circumstances,"
63;291020;293090;"you would spend a long time"
64;293090;296590;"meditating and discovering your own auras,"
65;296590;300400;"while slowly opening those apertures."
66;301000;304900;"Even Zushi, a natural talent, 
required three months."
67;307760;310530;"However, you two could do it in a week."
68;310530;313160;"Or even sooner."
69;315160;317250;"Which is why I find it unfortunate"
70;317250;321010;"that we have such little time to work with."
71;321010;322550;"I don't really get it..."
72;323310;327050;"But quick and dirty is always better."
73;328200;331060;"This is a shady, highly frowned upon method."
74;331790;334180;"You will be ignoring the correct procedure."
75;334180;335680;"You could even die,"
76;335680;339310;"if the person using this method 
were weak or evil."
77;339940;344210;"But you aren't weak, and you aren't evil."
78;344210;345030;"Right?"
79;348730;350030;"That's why I want to know..."
80;350050;355540;"Shroud   Force 
Null 
Act"
81;350740;352040;"Why would you"
82;352040;355540;"suddenly decide to teach us the 
true four major principles?"
83;356270;358540;"Because I did not want to 
squander this opportunity."
84;359270;361550;"If you were to challenge the 200s,"
85;361550;364800;"with none of this knowledge, 
you would suffer greatly."
86;365730;369930;"Up there, everyone knows 
how to manipulate <i>Nen</i>."
87;371540;374440;"And they have a special 
greeting for any newcomer"
88;374440;375940;"ignorant of <i>Nen</i>,"
89;375940;377940;"a <i>Nen</i> attack."
90;378650;381490;"In other words, they do what I am about to,"
91;381490;383440;"but without restraint."
92;383990;387950;"They don't care, even if people die..."
93;390910;395610;"Only those who survive 
are allowed to pass."
94;395610;396950;"They are the chosen."
95;399690;402250;"However, they pay a steep price."
96;402760;405210;"That's why I wanted you to be prepared."
97;406210;409420;"Now, despite my attempts to scare you,"
98;409420;412720;"I have confidence that this 
will awaken your power!"
99;413170;414910;"You have the potential."
100;415650;417220;"As well as the ability."
101;417680;420690;"Put your belongings down, 
take off your shirt,"
102;420690;422840;"and turn your backs toward me."
103;433820;435610;"It's so hot!"
104;435610;440460;"And I can feel pressure, even though 
Wing-san isn't touching me."
105;441000;443540;"This is it! That sensation..."
106;443540;447710;"Like something invisible and slimy, 
crawling across my skin."
107;448860;451760;"Amplify this by millions of times,"
108;451760;454140;"and it'd feel like my brother's <i>Nen</i>{\fscx40} {\fscx100}?"
109;455820;457140;"I'll begin."
110;469710;473660;"Every micropyle on your bodies has opened."
111;475560;477160;"Th-This is..."
112;478050;481550;"That is your aura, or life energy."
113;481550;482960;"You can see it now,"
114;482960;485920;"because the micropyles in your 
eyes were also opened."
115;486350;487740;"It's like smoke."
116;488240;491800;"Like steam, rising from the spout of a kettle."
117;492350;494800;"It's rushing out from every part of my body."
118;495470;497450;"It won't stop gushing out."
119;498060;500310;"Isn't that dangerous?"
120;500830;503000;"This is your life energy,"
121;503000;506520;"so if it continues to escape, 
you will grow tired."
122;507290;509040;"If you expend all your aura,"
123;509040;510820;"you will collapse from fatigue."
124;511310;512570;"Really?"
125;514790;516230;"Listen to me."
126;516230;519450;"You must concentrate on keeping 
your aura within your body."
127;520090;521450;"Close your eyes!"
128;524550;529210;"Use any stance that helps you to focus."
129;529640;534220;"Then visualize your aura flowing 
like blood through your body."
130;535020;537720;"From the top of your head, 
to your right shoulder."
131;538400;542220;"To your hand, before passing through
 your legs, to the left side."
132;543600;547300;"And now visualize that flow 
beginning to ebb"
133;547950;551980;"and hovering around your body."
134;562580;565000;"These boys are incredible."
135;565000;568420;"I didn't need to tell them that a natural stance"
136;568420;570630;"would be the most effective."
137;571370;574410;"With minimal advice, they've already 
mastered the technique."
138;576300;577720;"Magnificent..."
139;578340;580200;"And terrifying."
140;582160;584020;"Slowly open your eyes."
141;584550;585640;"How do you feel?"
142;586430;590650;"I feel like I'm surrounded by some 
kind of warm mucus."
143;591150;594800;"Yeah, like I'm wearing weightless clothes."
144;596080;598900;"Continue to maintain those images."
145;599580;602800;"Once you've assimilated them, 
you'll be able to use <i>Ten</i> while asleep."
146;608860;612850;"Next, I will use hostile <i>Nen</i> against you!"
147;618800;620910;"Previously, it would have"
148;620910;623510;"been painful for you to stand within this."
149;624150;625300;"Yeah,"
150;625300;630520;"I understand your blizzard analogy now."
151;631200;634950;"If you can fend off my <i>Nen</i>,"
152;634950;637030;"you'll be able to break through his barrier!"
153;639380;640530;"Here I come!"
154;702280;705450;"Welcome to the 200s."
155;705450;708300;"It appears that I needn't bother 
with the traditional greeting."
156;710550;714860;"I can guess why you've come 
to Heavens Arena."
157;715330;719360;"You intended to train before challenging me..."
158;719900;724070;"Yeah, but I didn't expect to find you here."
159;724620;726330;"That saves me time."
160;729040;732250;"You should avoid being overconfident 
in your ability to use <i>Ten</i>."
161;733920;735980;"There is much to learn about <i>Nen</i>."
162;737040;738210;"To be honest,"
163;738560;741980;"at present, I feel no urge to fight you."
164;745740;746600;"However..."
165;748370;751750;"If you manage to win a single 
match in the 200s,"
166;751750;753480;"I shall accept your challenge."
167;761230;762310;"Let's go."
168;763210;764490;"Yeah."
169;769470;770790;"Newcomers?"
170;770790;772430;"Looks like it."
171;774500;777420;"Seems that they can use it."
172;777420;779000;"Indeed..."
173;790600;793140;"Welcome to the 200s!"
174;793140;795600;"Please fill out the forms here."
175;796570;799300;"Would you like to register for a match now?"
176;800840;803940;"In this class, there is a self-service system"
177;803940;807110;"by which you're permitted 
ninety days of preparation."
178;807430;811620;"You may choose to fight on 
any day during that time."
179;811620;815120;"Of course, you're free to fight every day,"
180;815120;818630;"and you can also wait until 
the very last day to fight."
181;819170;820830;"Once you've participated in a fight,"
182;820830;823760;"you have another ninety days to prepare."
183;824110;827030;"However, if you don't fight before 
those ninety days end,"
184;827030;828560;"you will be disqualified,"
185;828560;831840;"and your name will be struck from all records."
186;831840;835930;"Does that mean we'll be fighting 
in this class multiple times?"
187;835930;836940;"Yes,"
188;836940;840680;"you need ten wins to clear this floor."
189;841220;844240;"However, if you lose four times before ten wins,"
190;844240;846420;"you'll be disqualified."
191;847340;848410;"And"
192;848410;851700;"if you win ten times,"
193;851700;855540;"you have a chance to challenge 
the Floor Masters!"
194;855840;860760;"The Floor Masters are the twenty-one 
strongest fighters here."
195;860760;864110;"Each claims one of the floors,"
196;864110;866820;"from 230 to 250."
197;867490;869250;"Do you understand now?"
198;869250;871370;"If you defeat a Floor Master,"
199;871370;875510;"you become the new master of that floor!"
200;876420;878160;"Th-That's not all!"
201;878160;880690;"If you become a Floor Master,"
202;880690;883980;"you earn the right to participate in"
203;883980;889950;"the biennial celebration of 
combat, Battle Olympia!"
204;893240;894450;"No reaction?"
205;895000;896760;"Forget that."
206;896760;898830;"Is there anything special about the top floor?"
207;899100;900770;"That's what you want to know?!"
208;900770;902740;"The champion of Battle Olympia"
209;902740;905090;"gets to live on the top floor!"
210;905090;907360;"It's an incredible honor."
211;908590;912110;"A penthouse 1,000 meters above the ground..."
212;912110;913100;"Don't you get it?!"
213;913100;918050;"But Killua's house is 3,700 meters 
above ground, right?"
214;920350;925720;"A-And the champion always 
receives a prize of..."
215;925720;927100;"What do you wanna do, Gon?"
216;927100;929580;"Now that I know the top floor's secret,"
217;929580;930490;"I don't care anymore."
218;931440;935240;"Yeah! I just want to fight with Hisoka."
219;936590;940500;"Why are you kids even here?"
220;940500;944160;"Well, then you'll need to win a fight."
221;944160;946500;"But you're gonna wait a bit first, right?"
222;947210;948420;"No..."
223;949920;951080;"I'm doing this!"
224;952090;956450;"I have to find out how different 
these opponents are."
225;959130;962750;"I'll need you to fill out this form, as well."
226;962750;964020;"Okay!"
227;971220;972530;"You want something?"
228;972850;975030;"No, not really."
229;975400;979290;"We're simply in line to register for a fight."
230;987460;988920;"Oh, I get it."
231;988920;993170;"Gon, these guys want to fight 
on the day you do."
232;1007020;1009980;"I'm ready to go whenever."
233;1010940;1012350;"There you go."
234;1013210;1015990;"This boy has plenty of spunk."
235;1021650;1025050;"Then Gon-sama will be in room 2207."
236;1025050;1028600;"Killua-sama will be in room 2223."
237;1030170;1032720;"We will let you know which day your match is."
238;1033620;1034860;"Thanks!"
239;1048230;1051340;"They must have gone through"
240;1051340;1053780;"that greeting Four-Eyes mentioned."
241;1055580;1057030;"If we'd gone in blind,"
242;1057670;1059700;"we could've ended up like them."
243;1059700;1062320;"Wow! This room is huge!"
244;1062320;1064170;"Hey, are you listening to me?"
245;1064170;1066160;"The bath is squeaky clean."
246;1066770;1070820;"Whee... I've never seen such a big bed!"
247;1070820;1072050;"Look, Killua..."
248;1075090;1076050;"Hey, Gon!"
249;1080550;1084060;"{\an7\fs22}Your battle has been set 
for 3 PM, March 11th!!"
250;1084290;1086060;"What? Tomorrow?!"
251;1086060;1087310;"That's fast."
252;1094290;1096950;"I probably won't be able to win tomorrow."
253;1097510;1099160;"But that's okay."
254;1099650;1101660;"I need the experience."
255;1104130;1107910;"I need to discover what I 
can do with this power."
256;1119570;1122390;"Okay, we have a thrilling match for you today."
257;1122730;1125530;"First, we have Gon, who managed"
258;1125530;1128420;"to zip straight to this class!"
259;1131140;1132950;"His opponent will be Gido,"
260;1132950;1137250;"who currently holds a respectable 4-1 record."
261;1155520;1158220;"Listen to me, Gon-kun. Killua-kun."
262;1159020;1162050;"Ten is a purely defensive technique."
263;1162050;1164570;"You have not improved 
your offensive capabilities."
264;1164570;1169270;"Plus, you will still take damage 
from physical attacks."
265;1170420;1173310;"A highly skilled Nen opponent"
266;1173310;1175690;"will be able to penetrate your Ten,"
267;1175960;1178880;"and deal a lethal blow."
268;1178880;1182200;"So you should wait two months 
before you start fighting."
269;1182580;1186200;"During that time, I will 
teach you as much as I can."
270;1187560;1189960;"Sorry, Wing-san."
271;1190840;1193770;"But I'm itching to fight right now!"
272;1200640;1202000;"Good grief."
273;1202000;1203970;"That boy is a real handful..."
274;1204660;1205640;"And..."
275;1206180;1206970;"Begin!"
276;1220800;1223950;"{\an8}Dancing Tops"
277;1225470;1228450;"There they are, Gido's Dancing Tops!"
278;1228760;1234210;"He uses numerous tops to 
attack his opponent!"
279;1234430;1235760;"Here we go..."
280;1236380;1238960;"{\an8}Battle Waltz!"
281;1257070;1258540;"Clean hit!"
282;1259120;1261800;"Oh, Gon gives up a clean hit"
283;1261800;1264090;"and one point, right off the bat!"
284;1264090;1265890;"He's off to a rough start."
285;1265890;1267070;"Damn!"
286;1267330;1268910;"I can use <i>Nen</i>"
287;1268910;1271580;"to keep these tops spinning 
for hours, as my attack."
288;1271580;1273500;"The attack pattern is so complex,"
289;1273500;1278540;"even I don't know what will come next!"
290;1280120;1283550;"Tops spinning into each other 
and attacking me..."
291;1284880;1289440;"That small top deals damage 
equivalent to a hammer!"
292;1291750;1296430;"Gon has begun his first battle of the 
200s class, which is filled with <i>Nen</i> users."
293;1296930;1300090;"The 200s class is nothing like he expected."
294;1301610;1305720;"Can Gon survive this predicament?"
295;1307880;1309320;"Or not?"
296;1381060;1382660;"Coming up, we have Gon"
297;1381060;1386110;"Gon and Killua's Hunterpedia"
298;1381060;1386110;"Brush Your Teeth. 
Unripe Fruit"
299;1382660;1383490;"and Killua's"
300;1383490;1385280;"Hunterpedia!"
301;1386110;1386570;"Gon and Killua's Hunterpedia"
302;1386750;1387570;"It's Gon"
303;1387570;1388400;"and Killua's"
304;1388400;1389920;"Hunterpedia!"
305;1388700;1399580;"Gon and Killua's Hunterpedia"
306;1389920;1391810;"Today, we introduce Gido!"
307;1391510;1395490;"A Heavens Arena 200s-class 
fighter who is Gon's first 
opponent."
308;1391810;1394110;"He fights with <i>Nen</i>-controlled tops."
309;1394110;1397430;"He may even turn himself into one, and spin into you!"
310;1395490;1399580;"An enhancer, who plays 
while he fights."
311;1397430;1399870;"Spin round and round..."
312;1405750;1408100;"Next time: Fierce x And x Ferocious!"
313;1408100;1409780;"Don't be too reckless."
314;1409780;1412220;"A real friend would support 
my reckless behavior."
315;1412220;1414560;"That's just reckless."