Number;Start time in milliseconds;End time in milliseconds;"Text"
1;6800;7650;"So, then..."
2;8110;10390;"Where are we on the island?"
3;10780;13650;"Let's steal an Accompany card and go."
4;19580;21410;"Uninvited guests?"
5;25540;27490;"I'm getting nervous..."
6;28300;30220;"Just so we're clear,"
7;30220;32280;"you didn't wash up on shore, right?"
8;32930;35600;"After all, if you'd let the waves carry you,"
9;35600;38460;"it would be impossible to reach this island."
10;40140;41930;"This guy's strong."
11;42690;44230;"Who are you?"
12;44230;46560;"Are you supposed to be our tour guide?"
13;46950;49640;"I'm one of the designers of this game."
14;49990;51390;"The name's Razor."
15;52190;55090;"I mainly handle the Emitter spells,"
16;55090;56740;"including all movement via spells"
17;56740;58740;"and dealing with external threats."
18;59490;64000;"Eliminate 

Send all trespassers 
on Greed Island to a 
random location on 
the Azian continent 

[LR][SP]"
19;60250;63430;"This is a special spell only usable by Game Masters."
20;64510;66760;"Sorry, but you'll have to leave."
21;68030;71140;"You're more than welcome to 
visit via official channels."
22;71140;74880;"From there, if you defeat me, 
you can receive an item."
23;75330;76450;"Should you decide to play,"
24;76450;79010;"we'll probably get to fight eventually."
25;79470;80560;"Sounds good..."
26;80560;81810;"We'll come back."
27;81810;83770;"Through the front door."
28;84020;85690;"Eliminate on."
29;89810;93930;"Hmm, those were some strong <i>Nen</i> users..."
30;189960;195000;"Evil Fist x And x Rock-Paper-Scissors"
31;197090;199160;"As Gon continues to train,"
32;199160;202510;"he discovers a hint to developing 
a new technique, and that is..."
33;202960;204970;"First comes rock!"
34;205670;207260;"Rock... Paper..."
35;207260;208580;"Rock!"
36;215670;216780;"I see."
37;217090;218030;"Here comes the next one!"
38;218630;220780;"First comes rock!"
39;221260;222530;"Rock... Paper..."
40;222530;223860;"Paper!"
41;226830;229600;"Bisky, how do I make my <i>Nen</i> fly?"
42;230310;231420;"Train more!"
43;231910;233420;"So paper is an Emitter technique?"
44;233930;234570;"Uh-huh."
45;234980;236790;"And Scissors is a Transmuter technique."
46;237310;240170;"I wanna be able to cut through rock."
47;240540;241690;"I understand."
48;241690;243680;"That's a reasonable fighting technique."
49;244400;246180;"But such a childish idea."
50;246770;250600;"You know how it takes time 
to focus <i>Nen</i> in my fist?"
51;251010;254180;"I was trying to think of a good 
way to spend that time."
52;254960;258280;"And when you were talking about 
rock-paper-scissors, it hit me."
53;258280;260280;"Because I like rock-paper-scissors."
54;260960;263530;"Trusting your instincts is important."
55;263530;266560;"Your gut plays a big role in 
techniques that require"
56;266560;268330;"multiple <i>Nen</i> categories."
57;268850;271150;"The key is that it should feel right to you."
58;271800;273130;"Ah... Ahem."
59;281730;284320;"Well, this is all I can manage right now,"
60;284320;286500;"but if I charge it up, it's pretty strong."
61;287370;289140;"That's awesome, Killua!"
62;289140;290720;"You're like an electric eel!"
63;290720;292020;"That's a horrible comparison!"
64;293520;297020;"<i>He can already change </i>Nen <i>into 
electricity at such a young age?</i>"
65;297640;298810;"Frightening..."
66;299390;302030;"And very tragic..."
67;302880;305030;"His childhood must have been a living hell."
68;305510;309380;"It's a miracle that he can smile now."
69;313570;315040;"Indeed..."
70;316340;318290;"They make a great team."
71;320870;323760;"Well, let's take a break, then."
72;324810;327280;"It's a little early, but we can have a party."
73;327280;328420;"A party?"
74;328420;331240;"What do you boys do back home to celebrate?"
75;331240;332310;"Celebrate?"
76;333450;336440;"In the outside world, it's almost New Year's."
77;337310;340250;"Time flows at the same speed 
inside the game as outside."
78;340890;341800;"Oops!"
79;342960;346700;"The deadline to apply for the 
Hunter Exam is coming up!"
80;347120;350700;"And our training was just starting to get fun..."
81;351160;354290;"I believe you're required to apply 
before the end of the year."
82;354660;356130;"We need to hurry."
83;356130;358410;"How do we get outside?"
84;358770;361380;"I'm guessing there are spell 
cards to leave the game?"
85;361800;365010;"In that case, let's head to Masadora."
86;365430;366470;"Agreed!"
87;368410;371250;"Well, let's find a place to have a drink."
88;371250;374030;"We can't... There's no time."
89;374030;376270;"We can ask around the stores."
90;377400;379270;"How to leave the island?"
91;379830;382200;"That'll be 3,000 Jenny."
92;384700;387150;"If you go about fifty kilometers west,"
93;387150;389410;"you'll reach the island's only port."
94;389820;394030;"You must defeat or bribe 
the chief of that port"
95;394030;396290;"to receive a ticket that will 
transport you outside."
96;396770;398540;"How big of a bribe are we talking?"
97;398990;400880;"Depends on how the chief's feeling."
98;400880;401790;"Ah..."
99;402140;405450;"Your other option is to 
use a Leave spell card,"
100;405450;407550;"but that's a rare one."
101;408230;409360;"What do we do?"
102;409360;410680;"Let's head for the port."
103;410680;414140;"If it's a rare card, we could buy 
a bunch without finding one."
104;414480;415510;"True."
105;425400;426820;"Passage Ticket"
106;425410;426220;"Voilà."
107;427450;430640;"Well, I'll go pass the test real 
quick, and then hurry back."
108;431340;434410;"There are monsters called Kiriko 
that live beneath a cedar tree"
109;434410;436450;"on the mountain behind Dolle Harbor."
110;436740;438580;"If you tell them you're my friend,"
111;438580;440210;"they'll take you to the exam area."
112;440670;441700;"Okay."
113;441700;442530;"See ya."
114;446970;450220;"Then let's get back to training."
115;450220;451010;"Osu!"
116;463280;464270;"Welcome."
117;464950;466680;"Is this where I started?"
118;468000;469370;"No, it's not..."
119;469870;471460;"The girl looks similar, though."
120;472170;474530;"Well, that's not so unusual in games."
121;475000;476800;"You are leaving the island, right?"
122;477100;479500;"Please select a destination."
123;480680;481780;"Do you know Dolle Harbor?"
124;482120;483690;"Yes, I do."
125;484110;485290;"Then send me there."
126;485810;487120;"Understood."
127;488550;490240;"When you leave this island,"
128;490240;493650;"the cards in your free slots will disappear."
129;493650;494990;"Is that okay?"
130;495300;496550;"Yeah, it's fine."
131;497210;500470;"Then we shall await your return."
132;506990;509310;"I'm back in the real world now?"
133;509900;511830;"Doesn't feel that way."
134;512800;513630;"Book."
135;515190;517620;"Oh, it doesn't work out here."
136;519680;522810;"Once I submit my application, 
I'll head for that cedar tree."
137;523790;525960;"First, I should shower and 
change into fresh clothes."
138;528030;530380;"Okay, train while you run!"
139;531010;535110;"When you can form the numbers from 0 to 9 
in one minute, you'll clear this stage."
140;538800;541390;"That hurt!"
141;541880;543560;"What are you doing?"
142;549290;550580;"Aren't you..."
143;551090;553240;"Your other friend isn't here?"
144;554130;556210;"What's that machine on your shoulder?"
145;556210;558160;"Did something happen?"
146;558950;560590;"We were fooled by the Bomber."
147;560840;563480;"Will you listen to my story?"
148;567400;569130;"So he was the Bomber..."
149;569670;574060;"The others are waiting at our base for 
the Bomber to disarm the bombs."
150;574870;576730;"They believe the terms he gave them,"
151;576730;578890;"even though it was probably a bluff."
152;579460;581620;"Can't anything be done?"
153;581620;583820;"If they're prepared to accept casualties..."
154;583820;584890;"It's impossible."
155;585550;590140;"The first people to attack 
will be the ones who die."
156;590560;592410;"Who would volunteer for that role?"
157;593470;594400;"True..."
158;595010;598030;"Jispa was our group's strongest fighter,"
159;598030;600160;"and he was defeated in an instant."
160;600600;602960;"At that point, our loss was assured."
161;603890;606220;"And allowing him to leave the game"
162;606220;607590;"was a fatal mistake."
163;609110;611190;"We indulged in a moment's victory cheer"
164;611190;614960;"before we could verify each 
member's cards and assign roles."
165;615640;617970;"That's when he caught us off guard."
166;619090;620470;"It's embarrassing to admit,"
167;621080;624710;"but I was so distracted, 
I didn't notice him using Leave"
168;624710;626840;"until it was already too late."
169;627790;632360;"You were probably focused on 
understanding his explanation."
170;632710;633530;"Yeah."
171;633800;637640;"We were thrust into that 
situation with no warning."
172;637950;641210;"Given our mental state, there was 
no action we could have taken."
173;641610;645120;"But why are you telling us this?"
174;646510;648960;"Because, of everyone I've met on this island,"
175;648960;651680;"you are the ones I believe I can most rely on."
176;653320;655680;"If you run into any other players,"
177;655680;658370;"please tell them about the Bomber."
178;658900;660660;"Once everyone knows how his ability works,"
179;660660;662140;"they should be able to protect themselves."
180;662760;666400;"And if possible, I would 
like you to avenge us!"
181;667170;668160;"If not,"
182;668160;671210;"could you at least promise that 
you won't let him clear the game?"
183;672390;672960;"Yeah."
184;673280;674400;"Understood."
185;674980;675970;"Sorry..."
186;678690;680450;"I'll use what time I have remaining"
187;680450;683230;"to tell as many as I can about the Bomber."
188;683910;684550;"Book."
189;685590;686810;"Return on."
190;686810;687540;"Bunzen!"
191;696630;697720;"Just kidding..."
192;698270;702170;"The truth is that they were 
the only players I could find"
193;702170;704050;"using Magnetic Force."
194;705330;707550;"Even a pig can climb a tree if 
you give it enough praise."
195;708050;709940;"Every thousandth of a percent counts"
196;709940;713120;"<i>when it comes to deactivating someone's </i>Nen."
197;714050;718380;"Well, Nickes probably left to 
meet with the bombers."
198;719130;721200;"If the mass disarmament"
199;721560;724260;"turns out to be a mass explosion..."
200;726340;727450;"I should get started."
201;736020;737960;"You're finally here."
202;738430;740460;"Now give me your ring."
203;741290;743220;"Jispa's dead."
204;743590;745470;"That's nice. Your ring."
205;746520;748470;"Disarm everyone's bombs first!"
206;749310;750470;"Hell, no."
207;750840;753630;"I have to enter the game with your ring,"
208;753920;758480;"and confirm that the cards 
really are all inside."
209;759020;760990;"I'll disarm the bombs after that."
210;761580;763100;"I'll give you one more chance."
211;764480;765990;"Hand over the ring."
212;773730;775270;"Sub, put it on."
213;776490;779410;"If you put on a second ring outside the game,"
214;779410;781570;"you'll overwrite the data."
215;782970;786060;"Now, let's head back inside together."
216;786480;789010;"Wait, what was your name?"
217;796920;799480;"Migamura, Samingadura,"
218;799780;802530;"Interaminga, Zenberarubura."
219;803020;804590;"Spirits of the forest,"
220;804940;808020;"<i>remove the tainted</i> Nen <i>that resides within me.</i>"
221;815640;816570;"Now, then..."
222;817880;819800;"What horrors will come of this?"
223;824020;826320;"I borrow power from the forest spirits,"
224;826670;828620;"to use my Conjurer ability"
225;829170;832790;"<i>to create a</i> Nen <i>beast, capable of 
consuming other people's </i>Nen!"
226;836980;837870;"It's huge!"
227;838420;842470;"The Bomber's Countdown must be 
a particularly strong technique."
228;845870;846970;"How'd it go?"
229;846970;848460;"Has he disarmed the bombs yet?"
230;849730;850320;"Book."
231;855380;857820;"81 restricted slot card types."
232;857820;859710;"They're all here, all right."
233;859710;861900;"We did as you requested..."
234;861900;863590;"Disarm the bombs!"
235;864090;865370;"But of course."
236;865370;866770;"I'm a man of my word."
237;866770;869840;"But first, hand over three Leave cards."
238;873770;876110;"Okay, we have a deal."
239;876490;877880;"Sub... Bara..."
240;900550;901490;"Let's do this."
241;905980;906960;"Release."
242;928690;930330;"I released you"
243;931570;933240;"from your terror."
244;936430;939370;"Th-That wasn't the deal..."
245;941640;943290;"Why should I keep a promise"
246;943290;945880;"I made to a bunch of scum?"
247;946260;949880;"Release was the signal to explode, not disarm."
248;954270;955550;"Leave on!"
249;959780;963170;"At least now, I don't have 
to worry about exploding."
250;965780;970940;"But until Genthru reverses his ability or dies,"
251;971250;973670;"this thing won't disappear."
252;974930;977810;"I have a troublesome partner now..."
253;981270;982710;"Hey, stop moving!"
254;984210;986630;"The Bomber thinks he killed us all."
255;987540;989350;"I'll let him believe that..."
256;990230;991840;"Until I make my move!"
257;999720;1000470;"Bisky..."
258;1003240;1006760;"I think we should drop by 
their base real fast."
259;1007610;1009450;"They already ran out of time."
260;1010020;1013240;"Besides, he didn't even 
tell us exactly where it is."
261;1013720;1015500;"And even if we did know,"
262;1015500;1019240;"we don't have a spell card 
that could take us there."
263;1019860;1021100;"I know."
264;1021100;1024850;"But some of them might have 
survived the explosion..."
265;1024850;1026010;"Doubt it."
266;1026760;1030920;"If the Bomber's strong enough to place bombs 
on all his targets without anyone noticing,"
267;1031330;1033290;"he wouldn't have made that kind of mistake."
268;1034560;1035300;"However..."
269;1036090;1038400;"If we continue to play this game,"
270;1038400;1040530;"we'll probably run into the Bomber."
271;1041190;1046040;"Given that, we may need 
to visit their base soon."
272;1046040;1046700;"Uh-huh."
273;1047670;1049120;"We need spell cards."
274;1049560;1051770;"Let's go to Masadora and 
sell our monster cards"
275;1051770;1052810;"to buy spell cards."
276;1053490;1054280;"Yeah!"
277;1058030;1058980;"Hey, Bisky..."
278;1059350;1062560;"How long do you think it'll take me 
to master my special technique?"
279;1063000;1065660;"You're just starting to develop your <i>Nen</i>."
280;1065660;1068230;"It's hard to predict when your 
power and speed will peak."
281;1068590;1069720;"Oh..."
282;1069720;1073430;"But it shouldn't take too long"
283;1073430;1075170;"before you get the form down."
284;1075610;1077280;"Really? How long?"
285;1077700;1079190;"Let's see..."
286;1081600;1084640;"Hopefully, you'll have it ready 
by the time Killua returns."
287;1086330;1087450;"All right!"
288;1087450;1090340;"I'll finish my technique and surprise him!"
289;1096670;1098650;"You two are lucky!"
290;1098650;1102200;"We just received a huge 
shipment of spell cards."
291;1102990;1105340;"These are the spell cards they'd gathered."
292;1109390;1112960;"We bought sixty between us, 
so there are lots of different types."
293;1114690;1115460;"Look."
294;1116970;1120970;"Prison 

All slotted cards on target 
page are immune to theft 
or destruction via spell 
card until removed. 
(Only targets pages 1 - 11. 
Free slot pages 
cannot be targeted.) 

[DEF][CONT]"
295;1117680;1118780;"An S-rank card..."
296;1118780;1120670;"There are only ten in the whole game!"
297;1121250;1122200;"What do you think?"
298;1122200;1122920;"Should we save it?"
299;1122920;1124470;"Or use it now?"
300;1124760;1127290;"I don't know what to do!"
301;1127290;1128020;"Shh!"
302;1128020;1129400;"You're too loud..."
303;1129400;1130730;"People will get suspicious!"
304;1133150;1135620;"{\fad(1,1111)}If only Killua were here..."
305;1142650;1144790;"I can smell Gon on you."
306;1145370;1146750;"I'd like to see him again..."
307;1149200;1151990;"We'll take you to the exam site."
308;1152400;1155070;"I need to zip on over and 
breeze through the exam,"
309;1155070;1157300;"so I can hurry back to Gon."
310;1157710;1161640;"But the exam won't begin for a few days."
311;1162020;1163260;"Oh, right."
312;1163800;1167570;"In the meantime, you can tell 
us about yourself and Gon."
313;1167900;1169000;"Okay."
314;1169000;1172590;"I'll start with the story about 
when he came to visit my home."
315;1185280;1187410;"You're making steady progress."
316;1187410;1190230;"You're on track to have your 
special technique ready."
317;1190780;1193420;"This is a safe place to practice."
318;1193860;1198800;"Since we'll be able to spot anyone 
before they're in attack spell range."
319;1199780;1201840;"I can sense people watching from Masadora,"
320;1201840;1204980;"just like I sensed people 
watching us at the start point."
321;1205770;1208680;"But we have plenty of defense spells now."
322;1210150;1211930;"Well, just to be safe,"
323;1211930;1214660;"I used a Blackout Curtain card."
324;1212210;1214940;"Blackout Curtain 

Block one instance of enemy Steal or Fluoroscopy. 
(Does not stack when used on target already under 
effect of Blackout Curtain.) 

[DEF][CONT]"
325;1216100;1219520;"But no point in worrying about spell cards."
326;1219960;1222100;"Just focus on training hard."
327;1222690;1223590;"Osu!"
328;1230970;1232740;"Okay, one minute's up."
329;1233620;1234460;"Next."
330;1242870;1243810;"It didn't work."
331;1243810;1245440;"I can't reach it..."
332;1245440;1246730;"That was just fine."
333;1246730;1249970;"You're in far better shape than 
a Transmuter would be!"
334;1250600;1253930;"Be patient, and start by focusing 
on maintaining your aura"
335;1253930;1256680;"in a sphere for extended periods of time."
336;1257210;1257980;"Osu!"
337;1258380;1262870;"The longer you can maintain the 
sphere, the stronger your <i>Ten</i>."
338;1263400;1264740;"Once you've trained long enough,"
339;1265170;1270470;"you'll be able to maintain an aura 
sphere for two to three days!"
340;1271980;1274770;"You should be able to reach that 
stone before the day's out."
341;1281240;1282900;"You're right! I reached it!"
342;1282900;1283760;"That was fast!"
343;1284490;1288070;"<i>This proves he's been hard at work 
on his</i> Ten <i>and</i> Ren <i>every day</i>."
344;1289520;1292660;"Then, we'll go back to practicing the basics."
345;1293660;1294530;"Osu!"
346;1296510;1300580;"Gon continues to train with Bisky, 
to master his special technique."
347;1301730;1305430;"Killua has temporarily left the game 
to retake the Hunter Exam."
348;1306450;1310900;"The two boys are working 
hard toward their goals."
349;1381150;1388780;"G.I. Tutorial"
350;1382000;1385120;"Coming up, it's the 
Greed Island Tutorial!"
351;1387580;1390300;"Today, we introduce the card Blackout Curtain."
352;1388780;1398910;"Blackout Curtain 

Block one instance of enemy Steal 
or Fluoroscopy. (Does not stack 
when used on target already 
under effect of Blackout Curtain.) 

[DEF][CONT]"
353;1390740;1391730;"With this card,"
354;1391730;1394810;"other players can't see inside your binder."
355;1395200;1397700;"You can see inside my binder 
whenever you want, Killua."
356;1397700;1398460;"What?!"
357;1399080;1400930;"Continue!"
358;1405380;1407660;"Next time: Strategy x And x Scheme."
359;1407660;1409420;"Hey, hey, hey, hey, Gon-kun!"
360;1409420;1411160;"Hey, hey, hey, hey, Killua-kun!"
361;1411160;1414510;"Hey, hey, hey, hey, show me what you've got!"