Number;Start time in milliseconds;End time in milliseconds;"Text"
1;4090;6090;"Damn... Almost."
2;9510;11780;"It didn't take long for the poison to kick in."
3;14020;15250;"What's going on?"
4;15660;18130;"He wasn't aiming for me..."
5;18660;20290;"He was aiming for the woman."
6;21270;22700;"He was trying to kill her!"
7;105000;110000;"Magic x Of x Despair"
8;127120;128290;"He's back."
9;134070;136400;"The King has returned."
10;159040;161430;"Hey, aren't we too close?"
11;161770;163250;"It's okay..."
12;163250;166680;"We aren't close enough to trigger APR's timer."
13;167590;172440;"The problem will be when 
the King and Pouf split up."
14;173180;177440;"Should I remove APR from Pouf, 
and use it on the King?"
15;180280;182420;"These are known as human grapes."
16;183120;186360;"The humans fit to become 
soldiers wait here to hatch."
17;196750;197540;"Hurry!"
18;198130;199060;"Hurry!"
19;200090;202590;"Hurry! Hurry! Hurry! Hurry!"
20;203260;205930;"Faster! Faster! Faster! Faster! Faster!"
21;211760;212810;"There it is."
22;213150;214240;"Hide it fast."
23;215030;216360;"Hurry! Hurry!"
24;217300;218980;"Faster! Faster!"
25;219350;220990;"Faster! Faster!"
26;222100;223430;"Hurry! Hurry!"
27;224360;227180;"Faster! Faster! Faster! Faster!"
28;226620;227880;"Hurry! Hurry!"
29;227880;229200;"We must also hurry!"
30;229920;231260;"Where is Welfin?"
31;238840;240110;"These won't work."
32;240560;244370;"When the bodies are ripped apart, 
I can't use Living Dead Dolls."
33;249950;250850;"Killua..."
34;253590;256020;"The King has arrived at the palace's entrance!"
35;256020;256790;"Yeah."
36;257300;259310;"We should circle around, following the wall,"
37;259310;261250;"and hide in the crowd."
38;261250;262200;"Okay."
39;264570;266030;"What about Gon and Pitou?"
40;266860;270000;"They just entered the Peijing hiding place."
41;271230;273000;"They're walking down a hallway."
42;275080;277860;"How does that crystal work now?"
43;278310;280240;"You can also see Pouf and me in it?"
44;280680;283560;"Yes, looking from a bit above."
45;285250;287620;"Wink Blue uses my crystal ball"
46;287620;290860;"to remember people seen through my right eye."
47;291350;293120;"Looking through only my left eye,"
48;293120;296700;"I can watch those people's current 
positions in the crystal ball."
49;298050;300550;"At the moment, the crystal ball 
is simultaneously showing"
50;300550;303510;"Gon and Pitou, Killua and me,"
51;303510;306010;"as well as Pouf, the King, and Youpi."
52;307540;310430;"It's like watching a TV screen 
that's been split up."
53;311030;317030;"However, my right eye has only 
seen Pouf, you, and Gon."
54;317670;321470;"So I can only see the others when 
they're around one of you."
55;322950;326720;"And I can only use my power to 
watch three people at once."
56;328010;331940;"If I see someone else with my right eye,"
57;331940;336230;"I won't be able to see the oldest 
of the three targets, Pouf."
58;336920;339960;"I'm not sure you need to keep watching Pouf."
59;340350;344610;"If you can only see his main body, 
and his clones are scattered,"
60;344610;347560;"it's probably more a minus than a plus."
61;348360;349740;"Is that so?"
62;351280;353630;"If I can only see his main body,"
63;353630;357370;"that also means I won't be fooled by clones."
64;358070;363630;"And if his main body is only the size 
of a fly, I can literally crush him."
65;366260;369530;"Our chance to defeat Pouf is while he's divided."
66;370410;372850;"What greater plus is there?"
67;376450;378390;"So they figured me out."
68;379070;382120;"Then I just need to use that against them."
69;426560;427690;"Walk forward."
70;447480;449370;"It's the right door, at the end."
71;472190;475950;"Even with all the noise echoing in the old castle,"
72;476390;480950;"Pitou's hearing was sharp 
enough to pick up the voice"
73;481250;485080;"on a cell phone hidden in a pocket."
74;486920;489370;"Pitou-sama, this is Welfin."
75;490750;493220;"I will keep this as brief as I can."
76;494100;497470;"Brovada and I have retaken the girl."
77;499720;503070;"Intruders are still around,"
78;503550;505430;"so we're taking refuge beneath the palace."
79;506380;508410;"I will let you hear her voice."
80;515590;518400;"Hello? Pitou-sama?"
81;519390;521250;"This is Komugi."
82;521590;525880;"I'm fine, so don't worry."
83;530420;531360;"Got it..."
84;532320;533050;"Goodbye."
85;550830;552780;"Was that good?"
86;553560;554780;"Yes."
87;555450;556690;"If possible,"
88;560820;564290;"can you get me a doctor, Pouf-dono?"
89;565270;566210;"It's him, right?"
90;567870;570590;"Since I can split myself at the cellular level,"
91;571070;573820;"I can also become different people."
92;574590;577590;"I can replicate faces, bodies, even voices."
93;581520;584850;"Now, Pitou is also under my spell..."
94;586370;590530;"The spell of the lie that will 
free Pitou from that curse."
95;592080;596240;"So, keep watching Gon and Pitou."
96;598360;601150;"You should see something interesting soon..."
97;663560;667270;"Now, heal Kite, like you promised."
98;668760;672150;"Once that's done, I'll release her."
99;680210;681280;"Your name..."
100;683290;686470;"What is your name?"
101;687500;688830;"Gon."
102;688830;690310;"Gon Freecss."
103;692750;693560;"Gon..."
104;694430;697190;"You listened to my request."
105;698930;703430;"So I will be honest with you."
106;707650;708560;"He is"
107;710310;711410;"already"
108;712180;713810;"dead."
109;739590;740920;"Dead?"
110;774290;778920;"He died during our fight."
111;791500;792920;"I remember now."
112;793960;796590;"Back then, you were..."
113;806400;810480;"I was unable to revive one who was dead."
114;811590;813700;"My power could only prevent"
115;814960;817730;"the body from decomposing,"
116;818810;820710;"and control its movements."
117;831070;834820;"His soul is no longer here."
118;835500;838980;"There is no way to heal him."
119;846580;847590;"I am sorry."
120;883240;884200;"Palm..."
121;884200;885040;"Yes?"
122;886290;887280;"Thank you."
123;891540;893980;"What? What's this?"
124;893980;895760;"What are you thanking me for?"
125;896270;897740;"Stuff..."
126;897740;901040;"Stuff? Such as?"
127;901800;905050;"Drop it! Stuff just means stuff!"
128;905420;907680;"What was that?"
129;907680;911430;"It seems wrong to make me mad 
while you're thanking me!"
130;912210;915640;"Don't worry... I'll never say thanks again."
131;920050;921640;"Because now we're friends."
132;923300;926120;"I never say thanks to my friends."
133;930170;931790;"Anyway, how's Gon?"
134;932720;935020;"Y-Yes, that's right..."
135;940530;941480;"What's wrong?"
136;942480;943710;"It can't be..."
137;944640;945960;"What's going on?!"
138;957930;959020;"Kite..."
139;964530;965600;"Kite is..."
140;967260;968430;"dead."
141;983370;985890;"Man, forced to take another life..."
142;986520;989280;"You've grown, Gon."
143;993430;994380;"If I..."
144;997220;998610;"If I..."
145;1000160;1001640;"Whether we win or lose,"
146;1002760;1005560;"hell lies ahead of us."
147;1009550;1011380;"If I hadn't gone with him..."
148;1013730;1016870;"Kite wouldn't have died."
149;1035040;1035870;"It was..."
150;1038080;1039420;"It was my fault."
151;1064030;1068700;"It was because I tagged along..."
152;1070520;1075360;"It was really my fault..."
153;1075750;1077180;"Get away from me!"
154;1085480;1088340;"It's my fault that Kite is..."
155;1090640;1093070;"No... It isn't my fault!"
156;1093410;1095600;"Pitou's the one who killed him!"
157;1095600;1097030;"Not me!"
158;1100770;1103430;"But it was me..."
159;1104860;1106500;"It was me...."
160;1111030;1113660;"I killed Kite."
161;1116920;1118560;"It's my fault..."
162;1120090;1122600;"No! It's Pitou's fault!"
163;1124390;1127430;"But it's really my fault."
164;1130100;1131520;"Kite is alive!"
165;1132950;1136900;"{\fad(1,347)}He wouldn't ever let that thing beat him!"
166;1139080;1140640;"Kite is dead..."
167;1141350;1142900;"Kite is dead."
168;1143650;1145300;"Kite is dead."
169;1146070;1147630;"Kite is dead..."
170;1148540;1150420;"Kite is dead!"
171;1152120;1153250;"Help..."
172;1154780;1156530;"Someone help..."
173;1157310;1159940;"Kite is... Kite is..."
174;1160430;1162930;"Kite is... Kite is..."
175;1163490;1164750;"Kite..."
176;1165660;1167490;"Just wait a little longer."
177;1169090;1170760;"I'll get you back to normal soon."
178;1178030;1180660;"I can't get him back to normal."
179;1181790;1184560;"Kite is gone..."
180;1185590;1187030;"It's my fault."
181;1187690;1189020;"Someone help..."
182;1190070;1191170;"Someone help Kite—"
183;1191170;1194210;"No! No! No! No! No!"
184;1195230;1197210;"But... But..."
185;1197210;1198210;"But..."
186;1198210;1200720;"But... But... But... But..."
187;1201080;1201720;"But..."
188;1211000;1212620;"Doctor Blythe."
189;1221120;1222250;"What?"
190;1223180;1225260;"Pitou's going to help Kite?"
191;1228940;1231640;"Oh, it's true..."
192;1232320;1234780;"Kite being dead was a lie."
193;1235770;1237680;"Pitou will heal him."
194;1241340;1242260;"Huh?"
195;1243500;1246470;"Why is it healing Pitou's arm?"
196;1247740;1250270;"Turn Kite back to normal."
197;1254560;1256140;"Please..."
198;1257270;1260230;"After you finish what you're doing."
199;1262480;1264700;"Why? What's going on?!"
200;1265020;1267960;"What's wrong? What happened, Palm?"
201;1267960;1269530;"I don't know..."
202;1269530;1272310;"I can only see what's happening..."
203;1272310;1273960;"But something is wrong with Gon!"
204;1273960;1275670;"What's wrong?!"
205;1276420;1280960;"Pitou is healing itself, not Kite."
206;1282130;1285300;"Gon is slumped on the floor next to Pitou."
207;1285760;1286580;"Impossible..."
208;1287970;1291480;"As long as she's in our hands, Pitou..."
209;1292800;1294960;"Pitou has to obey us!"
210;1315100;1316320;"Please..."
211;1317540;1318950;"Help Kite."
212;1404420;1406670;"Next time: Anger x And x Light."
213;1406670;1408220;"Hold on until I get there!"
214;1408490;1411510;"I don't care if this is the end..."
215;1411900;1414760;"I'll kill you, Pitou!"
216;1414760;1415610;"Gon!"