Number;Start time in milliseconds;End time in milliseconds;"Text"
1;3110;4410;"He's so far away..."
2;5410;8780;"But he's not out of reach."
3;11050;12970;"I need more training in Nen..."
4;13430;16240;"To find a power that's as strong as Hisoka's!"
5;111540;113090;"Mito-san!"
6;114740;116090;"Mito-san!"
7;118330;120160;"Mito-san!"
8;124080;125180;"Gon..."
9;126350;127780;"Gon!"
10;130080;131330;"Mito-san!"
11;133370;135110;"I'm home, Mito-san."
12;135510;137130;"Welcome home, Gon."
13;142530;144370;"You must be Killua, right?"
14;147120;152130;"Ging x And x Gon"
15;153970;154630;"Sheesh,"
16;155350;158630;"you should have let me know 
you were coming home."
17;158630;161140;"I didn't have time to prepare anything."
18;161650;163640;"It's not a big deal, whatever is fine."
19;163640;165400;"What are you saying?"
20;165400;168030;"Your friend came all the 
way out here to visit."
21;168030;170140;"No, it's okay."
22;170630;175040;"Honestly, you should have 
said something first..."
23;177020;178200;"Are you listening to me?"
24;180860;181910;"Oh, that's right..."
25;182320;185050;"Take a bath while I make 
something to eat."
26;185050;187140;"And put out your dirty clothes."
27;187140;188260;"I'll be doing laundry."
28;188260;189440;"Okay, later."
29;189440;190160;"Now!"
30;190160;191670;"You have ten seconds!"
31;191670;192760;"One."
32;192760;193830;"Two."
33;193830;194880;"Three."
34;194460;195870;"Is she always like this?"
35;194880;196080;"Four."
36;196080;197060;"Five."
37;196350;197430;"Pretty much."
38;197060;198160;"Six."
39;197430;199150;"Let's move fast!"
40;198160;199160;"Seven."
41;199160;199920;"Eight."
42;199920;200720;"Nine."
43;203670;206970;"Yeah, this is the life..."
44;209560;211680;"Okay, let's eat."
45;211680;213100;"Wow!"
46;213100;214690;"This looks delicious."
47;226100;227370;"What are you doing?"
48;228130;230370;"Offering our thanks."
49;230370;231830;"What does that mean?"
50;231830;232370;"All right..."
51;232370;234110;"Let's dig in."
52;234110;236400;"Please help yourself, Killua."
53;236400;237250;"Right."
54;251620;253050;"Oh, right, Mito-san."
55;254450;255020;"Look!"
56;255020;257300;"This is a Hunter License."
57;259680;260900;"Hmm..."
58;260900;262750;"It looks pretty normal."
59;264520;265070;"There."
60;266140;268620;"Hey, what are you doing?"
61;268990;270260;"Just kidding..."
62;270260;272040;"I would never do anything like that."
63;272040;275280;"Man, what if it doesn't work anymore?"
64;280690;284310;"Mito-san, I'm going to show 
Killua around the island."
65;285640;287390;"Won't that take a while?"
66;287390;289180;"Want me to pack some food for you?"
67;289720;291000;"That's okay!"
68;291000;293430;"We'll find something to eat in the forest."
69;344330;347150;"Gon and his friend are rather late."
70;347400;349990;"It's been a while since he 
was last on this island."
71;350710;353530;"And he's brought his first friend along."
72;355680;358660;"I'm sure they won't be back until it's late."
73;358960;360860;"You're right..."
74;364540;367680;"Maybe I should take some 
food out to them."
75;378280;379310;"Hey, Gon."
76;381290;384310;"What are you going to do now?"
77;388550;391710;"For now, I'll rest up here"
78;391710;394100;"while I gather information..."
79;394100;397410;"The information I'll need before I go  
to Yorknew to look for my dad."
80;399260;400380;"Oh..."
81;402820;404930;"What should I do?"
82;404930;405660;"Huh?"
83;406430;409770;"You should stay here and then 
go to Yorknew with me!"
84;409770;412530;"Yeah, I'm coming with you."
85;412530;414510;"That wasn't what I meant."
86;415700;417860;"I was thinking you're sort of admirable."
87;419970;421970;"There's nothing I really want to do..."
88;422530;425900;"I don't really have anything 
I want to do like you do."
89;432160;435600;"Though there are plenty of 
things I don't want to do."
90;436140;437410;"I don't want to stay in that house..."
91;437970;439780;"Or inherit the family business."
92;442660;445540;"I guess I'm a little jealous."
93;447490;448800;"Killua..."
94;450340;453430;"I think it's fun to be with you."
95;454860;457060;"Wh-What's that about?"
96;457560;459430;"Whale Island"
97;459430;463450;"is a place for fishermen to stay 
during extended outings."
98;463840;466640;"There aren't too many native residents."
99;467530;471710;"There's one other kid here that's 
around my age, and she's a girl."
100;471710;475820;"So you're my first friend who's the same age."
101;478190;480200;"My situation was similar..."
102;480200;482370;"Stuck in that house all day."
103;482820;485830;"I spent all my time learning how to kill."
104;486580;488470;"You were my first friend."
105;488470;491150;"Do you have fun when we're together?"
106;493280;495340;"I guess, yeah."
107;495880;498140;"Then let's stick together!"
108;498970;503410;"We can travel around and 
see the world together!"
109;504000;507300;"Don't you ever feel embarrassed 
saying that stuff?"
110;513800;515480;"I'll be looking for my dad."
111;517890;521140;"You'll be looking for what you want to do."
112;526440;528110;"It'll be a blast!"
113;530710;531840;"Yeah."
114;533010;534690;"Doesn't sound too bad."
115;536240;537500;"Okay!"
116;537500;541970;"I'll help you look for your dad until 
I discover what I want to do!"
117;541970;542830;"Okay!"
118;545660;548900;"Oh, what's your mom doing?"
119;558250;562790;"It's hard asking about my dad, 
but asking about my mom is even harder."
120;563930;567300;"Since Mito-san raised me by herself,"
121;567300;570780;"it would feel wrong to ask her that..."
122;571410;572920;"Is that how it works?"
123;573910;576650;"At first, Mito-san told me"
124;576650;579430;"my parents died in a traffic accident."
125;580550;583870;"She was worried that I 
might end up like my dad"
126;583870;587020;"if I learned he was alive and a Hunter..."
127;588250;590940;"And she was right."
128;592260;594260;"When I found out about my dad,"
129;594260;600490;"I kind of figured that my 
mom was probably dead."
130;601170;603620;"That's pretty harsh!"
131;605590;609310;"So I've always thought of Mito-san as my mom."
132;610690;612520;"She's the only mom I have."
133;612940;614950;"So there's nothing for me to ask."
134;614950;616510;"I don't need to."
135;617610;618730;"I see."
136;621010;622590;"Man,"
137;622590;625780;"I wish I had a mom like Mito-san..."
138;625780;627140;"She's the best!"
139;627140;628980;"Though she does nag a lot."
140;629570;631080;"That's nothing..."
141;631080;635720;"My mom starts crying the second 
I say I want to go outside!"
142;635720;637610;"She actually goes into hysterics!"
143;659860;660730;"Say..."
144;660730;661760;"What?"
145;661760;664060;"How long will you be staying?"
146;670300;672440;"Maybe a month?"
147;677750;679450;"After that..."
148;681260;683700;"I'm going to look for my dad."
149;696560;697700;"What's this?"
150;697700;699500;"Something Ging left with me."
151;699500;700410;"Huh?"
152;700410;704100;"He asked me to give this to you 
when you became a Hunter."
153;705700;708070;"My dad left this for me..."
154;708070;709220;"I'll tell you"
155;710420;713230;"everything I know about Ging."
156;719780;722580;"Ging is my cousin."
157;722580;725960;"My oldest memory of him is of his back."
158;726790;729670;"I was always running after him."
159;731010;733170;"I think back then, I was three..."
160;734140;738470;"I have the feeling that I was 
always looking at his back."
161;739870;744400;"At age twelve, Ging left the 
island to take the Hunter Exam,"
162;744400;746230;"just like you did."
163;748920;751770;"He suddenly said that 
he was leaving the island."
164;752110;755270;"When I asked him why, he told me this..."
165;757350;759400;""There's something that I want.""
166;761550;765950;"He never told me what it 
was that he wanted."
167;765950;767590;"We argued..."
168;767590;771160;"Actually, it was just me making a fuss."
169;771600;775550;"But I never got to see Ging again 
before he left the island."
170;776880;779170;"You were originally told"
171;779170;782670;"that your parents died in a 
traffic accident, right?"
172;782670;786180;"That was what happened to Mito's parents."
173;787740;791420;"It happened right after Ging left the island."
174;792450;793620;"After that,"
175;793620;798310;"Ging's father went missing on a fishing trip."
176;799840;804570;"Both of my sons ended up passing away."
177;806190;807320;"Yes..."
178;807770;810690;"All that happened after he left."
179;812700;817080;"Ten years later, Ging returned to the island."
180;817590;820220;"When he returned, he came carrying you,"
181;820220;822090;"and you were still a baby."
182;823040;825670;"He just popped up, out of nowhere."
183;825670;829260;"{\fad(1,515)}And he asked us to take care of you."
184;829260;833630;"When I asked about your mother, 
he'd only say that they were separated."
185;835130;840060;"I was about to agree to look after you, 
when I heard a loud,"
186;840060;842650;""Don't be silly!""
187;842650;845200;"I imagine everyone on the island heard it."
188;845200;847280;"Grandma, you don't need to mention that!"
189;847850;852700;"Anyhow, I knew we couldn't 
count on him to raise you."
190;854900;858850;"So we don't know anything 
about your mother."
191;860270;861790;"Mito even yelled,"
192;861790;866070;""Don't you ever come back!" 
while she cried..."
193;866070;867170;"Grandma!"
194;867620;872100;"Anyway, Ging left this with us then."
195;875110;878970;"This girl's tried to throw it away 
so many times..."
196;878970;884110;"That's because you always 
put it back where it was!"
197;884110;886040;"If you wanted to get rid of it,"
198;886040;890300;"you should have buried or burned it, 
rather than tossing it in the trash can."
199;896870;898120;"Do you understand?"
200;900270;901810;"That's it."
201;902330;905500;"That's all I know about Ging."
202;910320;911640;"Ging..."
203;912710;914050;"Ging, huh?"
204;914680;917050;"Ging... Ging..."
205;917410;920860;"Yeah, I'll use that."
206;921860;923130;"Hey, Mito-san..."
207;923130;924770;"Tell me more about"
208;924770;926890;"what Ging was like when he was little!"
209;928000;928810;"Huh?"
210;928810;931460;"Does it sound weird for me 
to use his name?"
211;931460;934020;"Somehow, it feels more natural."
212;934630;936790;"No, that isn't it."
213;937560;939940;"You want to hear what Ging 
was like as a child?"
214;939940;941040;"Yeah!"
215;944310;948250;"Hey, did Ging have any friends his age?"
216;948250;950610;"No, he didn't."
217;950880;953050;"Ging and I were the only children around."
218;953430;957490;"So I always wanted him to play with me,"
219;957490;959890;"but he would always run off."
220;959890;963600;"You were always getting lost."
221;964460;967070;"Honestly, you only remember 
the embarrassing stuff!"
222;968410;971030;"You followed Ging into the mountains,"
223;971030;973140;"but then you didn't come back."
224;973140;975090;"When Ging returned by himself,"
225;975090;979020;"the whole village panicked. 
And that happened several times."
226;980060;982550;"But when we went to look 
for you in the mountains,"
227;982550;986300;"Ging was always the first to find you."
228;986300;989590;"No matter where you hid..."
229;990410;992590;"After a few times,"
230;992590;997270;"people started wondering if you 
two were just playing pranks."
231;997270;998460;"What?!"
232;998460;1000920;"I would never do that!"
233;1000920;1004660;"Well, you always hid in places"
234;1004660;1006930;"that were impossible to locate."
235;1006930;1009880;"It was like you didn't want to be found."
236;1010480;1012580;"Really?"
237;1039740;1042020;"I guess so..."
238;1045350;1047800;"Oh, that reminds me of this other time."
239;1047800;1049250;"Ging and I were..."
240;1060690;1062090;"Oh?"
241;1064010;1065290;"I see."
242;1065630;1067810;"So this is the box."
243;1069090;1070040;"Huh?"
244;1071290;1074150;"How do you open it?"
245;1074150;1076590;"Yeah, I tried a bunch of methods,"
246;1076590;1078280;"but it wouldn't open."
247;1078620;1080500;"Mind if I use force?"
248;1080500;1081810;"Go ahead."
249;1082170;1083400;"Okay..."
250;1090860;1092050;"It's no use."
251;1092050;1093770;"This is no ordinary box."
252;1093770;1096840;"I should be able to twist 
open an ordinary steel box."
253;1098170;1103040;"And since we don't know what's inside, 
we can't break the box."
254;1103040;1104480;"It's not making a sound."
255;1106590;1108050;"Your dad said"
256;1108050;1111690;"to give this to you once you 
became a Hunter, right?"
257;1111690;1113450;"Yeah, that's what I heard."
258;1114300;1117380;"Once you became a Hunter..."
259;1124120;1125600;"I get it..."
260;1125880;1126920;"I figured it out!"
261;1127620;1130860;"Gon, there's one thing we haven't tried yet!"
262;1130860;1131800;"Huh?"
263;1131800;1135810;"Something you have as a Hunter 
that you didn't have before."
264;1135810;1137110;"Oh, I know!"
265;1137840;1139360;"My Hunter License!"
266;1139360;1143250;"But there isn't an opening for the card..."
267;1143250;1145220;"No, that isn't it."
268;1145220;1146600;"I meant <i>Nen</i>..."
269;1168730;1171500;"There's another box inside."
270;1176430;1177950;"These are just steel plates."
271;1178980;1181320;"It appears nothing was connecting them."
272;1182640;1183630;"What's wrong?"
273;1184920;1186080;"Doesn't that design"
274;1186550;1187950;"look familiar?"
275;1188650;1190080;"This is..."
276;1190080;1191210;"I know!"
277;1191840;1196300;"This is like the pattern on the promise 
thread Wing-san gave me."
278;1198380;1199760;"Wasn't that designed"
279;1199760;1203720;"to snap if <i>Nen</i> was used?"
280;1205920;1210020;"I bet this pattern holds a 
power similar to <i>Nen</i>."
281;1210340;1211730;"Maybe we're supposed"
282;1212030;1214200;"to put the card in here now."
283;1217350;1218250;"It worked!"
284;1218250;1219310;"Bingo!"
285;1221730;1222990;"A ring"
286;1222990;1224960;"and a cassette tape..."
287;1224960;1226400;"And a memory card?"
288;1229030;1230000;"Look."
289;1230490;1233350;"That pattern is on the back of this ring."
290;1233350;1235830;"You should take care before you put it on."
291;1235830;1237090;"Really?"
292;1237090;1238500;"You think that Ging"
293;1238500;1241140;"might try to hurt me?"
294;1241640;1243510;"Just to be safe."
295;1244120;1247480;"Well, we can start by listening to the tape."
296;1248550;1249800;"I guess."
297;1249800;1251800;"Oh, can you copy it?"
298;1251800;1253770;"Sure, why?"
299;1254190;1255700;"Just to be safe."
300;1276700;1278340;"Yo, Gon..."
301;1280980;1283640;"So you became a Hunter, too."
302;1285310;1288360;"Anyway, I have a question for you."
303;1291330;1294520;"Do you want to see me?"
304;1298370;1301650;"It was the first time Gon had 
heard his father's voice."
305;1302020;1303070;"Ging appeared"
306;1303070;1305840;"to have read Gon's mind"
307;1305840;1309280;"when he recorded his question."
308;1381060;1386110;"Brush Your Teeth. 
Unripe Fruit"
309;1381060;1386490;"Gon and Killua's Hunterpedia"
310;1381400;1382950;"Coming up, we have Gon"
311;1382950;1383650;"and Killua's"
312;1383650;1385300;"Hunterpedia!"
313;1386620;1387470;"It's Gon"
314;1387470;1388320;"and Killua's"
315;1388320;1389610;"Hunterpedia!"
316;1388700;1399960;"Gon and Killua's Hunterpedia"
317;1389610;1391290;"Today, we introduce Mito-san!"
318;1391290;1392400;"She raised me."
319;1391510;1393780;"Raised Gon and has been 
waiting on Whale Island"
320;1392400;1394820;"To me, Mito-san will always be my mom."
321;1393780;1395450;"for Gon to return."
322;1394820;1397440;"I wish I had a mom like Mito-san..."
323;1395450;1399960;"Ging's cousin and 
childhood friend."
324;1397440;1398270;"She's the best,"
325;1398270;1399510;"though she nags a lot!"
326;1406590;1408870;"Next Time: Reply x From x Dad!"
327;1408870;1411120;"Earthquake, thunderstorm, fire, or Dad."
328;1411120;1412960;"Which one scares you most?"
329;1412960;1414220;"Mito-san."